{
  "children": [
    {
      "children": [
        {
          "children": [
            {
              "children": [
                {
                  "componentVersion": "1.0.0",
                  "metadata": {
                    "id": "fake-appbar",
                    "title": "로그인·인증 후 원위치 복귀 상단 앱 바"
                  },
                  "layout": "layout.composite.componentAppBar",
                  "props": {
                    "showBack": true,
                    "showLogo": false,
                    "title": "로그인·인증 후 원위치 복귀"
                  },
                  "type": "AppBar"
                }
              ],
              "componentVersion": "1.0.0",
              "metadata": {
                "id": "NOVA-PRDD-PU-016-0.header-area",
                "title": "Header area"
              },
              "layout": "layout.area.areaAppBar",
              "props": {
                "name": "Header area"
              },
              "type": "area.static"
            }
          ],
          "componentVersion": "0.1.0",
          "metadata": {
            "id": "NOVA-PRDD-PU-016-0.header",
            "title": "Header"
          },
          "layout": "layout.region.header",
          "type": "Screen.Header"
        },
        {
          "children": [
            {
              "children": [
                {
                  "componentVersion": "1.0.0",
                  "metadata": {
                    "id": "fake-list-cell",
                    "title": "약관 목록 항목"
                  },
                  "layout": "layout.composite.componentListCell",
                  "props": {
                    "description": "회원 가입을 위해 반드시 동의가 필요합니다.",
                    "title": "[필수] 서비스 이용약관 동의"
                  },
                  "type": "list-cell"
                }
              ],
              "componentVersion": "1.0.0",
              "metadata": {
                "id": "NOVA-PRDD-PU-016-0.contents-area",
                "title": "Contents area"
              },
              "layout": "layout.area.accordionList",
              "props": {
                "name": "약관 목록 조회"
              },
              "type": "area.static"
            }
          ],
          "componentVersion": "0.1.0",
          "metadata": {
            "id": "NOVA-PRDD-PU-016-0.contents",
            "title": "Contents"
          },
          "layout": "layout.region.contents",
          "type": "Screen.Contents"
        },
        {
          "children": [
            {
              "children": [
                {
                  "componentVersion": "1.0.0",
                  "metadata": {
                    "id": "fake-action-button",
                    "title": "다음 CTA"
                  },
                  "layout": "layout.composite.componentActionButton",
                  "props": {
                    "fullWidth": true,
                    "label": "다음",
                    "variant": "primary"
                  },
                  "type": "ActionButton"
                }
              ],
              "componentVersion": "1.0.0",
              "metadata": {
                "id": "NOVA-PRDD-PU-016-0.bottom-area",
                "title": "Bottom area"
              },
              "layout": "layout.area.productHeroSummary",
              "props": {
                "name": "하단 액션"
              },
              "type": "area.dynamic"
            }
          ],
          "componentVersion": "0.1.0",
          "metadata": {
            "id": "NOVA-PRDD-PU-016-0.bottom",
            "title": "Bottom"
          },
          "layout": "layout.region.bottom",
          "type": "Screen.Bottom"
        }
      ],
      "componentVersion": "1.0.0",
      "metadata": {
        "id": "NOVA-PRDD-PU-016-0",
        "title": "로그인·인증 후 원위치 복귀"
      },
      "layout": "layout.screen.screenShell",
      "type": "Screen"
    }
  ],
  "metadata": {
    "id": "NOVA-PRDD-PU-016-0"
  },
  "minRendererVersion": "0.1.0",
  "theme": {
    "mode": "light"
  },
  "version": "render-tree.v0.1"
}
