{
	"version": "render-tree.v0.1",
	"minRendererVersion": "0.1.0",
	"metadata": {
		"id": "NOVA-PRDD-PG-015-1",
		"description": "선택 불가·충돌 사유 안내-선택 조합 충돌 (/nova/prdd/pg/015/1)"
	},
	"theme": {
		"mode": "light"
	},
	"children": [
		{
			"type": "Screen",
			"componentVersion": "0.1.0",
			"metadata": {
				"id": "screen.NOVA-PRDD-PG-015-1",
				"title": "선택 불가·충돌 사유 안내-선택 조합 충돌"
			},
			"layout": "layout.screen.commerceDetailScreen",
			"children": [
				{
					"type": "Screen.Header",
					"componentVersion": "0.1.0",
					"metadata": {
						"id": "region.header",
						"title": "Header"
					},
					"layout": "layout.region.header",
					"children": [
						{
							"type": "area.static",
							"componentVersion": "0.1.0",
							"metadata": {
								"id": "area.decor.area.0.0",
								"title": "선택 불가·충돌 사유 안내",
								"description": "sourceAreaId: 0"
							},
							"layout": "layout.area.areaAppBar",
							"children": [
								{
									"type": "AppBar",
									"componentVersion": "0.1.0",
									"metadata": {
										"id": "component.0.AppBarHeader",
										"title": "AppBarHeader",
										"description": "화면 상단 네비게이션"
									},
									"layout": "layout.composite.componentSectionMessage",
									"props": {
										"title": "선택 불가·충돌 사유 안내",
										"showBack": true
									}
								}
							]
						}
					]
				},
				{
					"type": "Screen.Contents",
					"componentVersion": "0.1.0",
					"metadata": {
						"id": "region.contents",
						"title": "Contents"
					},
					"layout": "layout.region.contents",
					"children": [
						{
							"type": "area.dynamic",
							"componentVersion": "0.1.0",
							"metadata": {
								"id": "area.decor.area.1.0",
								"title": "담기에 실패한 이유와 해결 방법",
								"description": "sourceAreaId: 1; errorPolicy: 영역 전체 숨김"
							},
							"layout": "layout.area.listStack",
							"props": {
								"sectionDivider": true
							},
							"display": {
								"stateRole": "base"
							},
							"children": [
								{
									"type": "TitleSection",
									"componentVersion": "0.1.0",
									"metadata": {
										"id": "component.1.TitleSectionFailReason",
										"title": "TitleSectionFailReason"
									},
									"layout": "layout.composite.componentSectionMessage",
									"props": {
										"title": "담기에 실패한 이유와 해결 방법"
									}
								},
								{
									"type": "Callout",
									"componentVersion": "0.1.0",
									"metadata": {
										"id": "component.1.CalloutFailReason",
										"title": "CalloutFailReason",
										"description": "실패 사유 축 구분과 수정 방법 안내"
									},
									"layout": "layout.composite.componentSectionMessage",
									"props": {
										"title": "{실패축} 문제로 담지 못했어요 (예: 가입 조건)",
										"children": "상품·옵션·조건·정책 중 어디서 막혔는지와 수정 방법을 확인하세요"
									},
									"display": {
										"stateRole": "error"
									}
								},
								{
									"type": "TextButton",
									"componentVersion": "0.1.0",
									"metadata": {
										"id": "component.1.TextButtonViewLater",
										"title": "TextButtonViewLater",
										"description": "나중에 다시 보기 보조 행동"
									},
									"layout": "layout.composite.componentSectionMessage",
									"props": {
										"label": "나중에 다시 보기",
										"underline": true
									}
								}
							]
						},
						{
							"type": "area.dynamic",
							"componentVersion": "0.1.0",
							"metadata": {
								"id": "area.decor.area.2.0",
								"title": "선택 구성 검증 결과",
								"description": "sourceAreaId: 2; errorPolicy: 오류 항목 미노출"
							},
							"layout": "layout.area.listStack",
							"props": {
								"divider": true
							},
							"display": {
								"stateRole": "base"
							},
							"children": [
								{
									"type": "TitleSection",
									"componentVersion": "0.1.0",
									"metadata": {
										"id": "component.2.TitleSectionComboResult",
										"title": "TitleSectionComboResult"
									},
									"layout": "layout.composite.componentSectionMessage",
									"props": {
										"title": "선택 구성 검증 결과"
									}
								},
								{
									"type": "ListText",
									"componentVersion": "0.1.0",
									"metadata": {
										"id": "component.2.ListTextDuplicateCheck",
										"title": "ListTextDuplicateCheck",
										"description": "중복가입 가능여부 확인 결과 표시"
									},
									"layout": "layout.composite.componentSectionMessage",
									"props": {
										"table": "on",
										"title": "중복가입 가능여부",
										"subText": "{중복가입판정결과} (예: 중복 가입 불가)"
									},
									"display": {
										"stateRole": "success"
									}
								},
								{
									"type": "ListSelected",
									"componentVersion": "0.1.0",
									"metadata": {
										"id": "component.2.ListSelectedGroupProduct",
										"title": "ListSelectedGroupProduct",
										"description": "그룹상품 구성·구성원 조건 선택"
									},
									"layout": "layout.composite.componentSectionMessage",
									"props": {
										"type": "radio",
										"label": "{그룹상품명} (예: 가족 결합 그룹)",
										"checked": true
									}
								}
							]
						}
					]
				},
				{
					"type": "Screen.Bottom",
					"componentVersion": "0.1.0",
					"metadata": {
						"id": "region.bottom",
						"title": "Bottom"
					},
					"layout": "layout.region.bottom",
					"children": [
						{
							"type": "area.dynamic",
							"componentVersion": "0.1.0",
							"metadata": {
								"id": "area.decor.area.999.0",
								"title": "화면 하단 액션 영역",
								"description": "sourceAreaId: 999"
							},
							"layout": "layout.area.bottomActionArea",
							"children": [
								{
									"type": "ActionButton",
									"componentVersion": "0.1.0",
									"metadata": {
										"id": "component.999.ActionButtonRecover",
										"title": "ActionButtonRecover",
										"description": "화면 하단 복구 진행 CTA"
									},
									"layout": "layout.composite.componentSectionMessage",
									"props": {
										"label": "계속하기",
										"variant": "primary",
										"fullWidth": true
									}
								}
							]
						}
					]
				}
			]
		}
	]
}
